{
  "$schema": "https://json-schema.org/draft/2020-12/schema",
  "$id": "https://github.com/Emily2040/seedance-2.0/schemas/clip-contract.schema.json",
  "title": "Seedance Clip Contract",
  "description": "Structural and record-local validation for one clip. Cross-record lineage semantics require project_state_check.py and continuity_chain_check.py.",
  "$comment": "A single-clip schema cannot prove that parent_clip_id exists, precedes this clip, is accepted with a usable endpoint, or participates in an acyclic unique-ID graph.",
  "type": "object",
  "required": [
    "project_id",
    "clip_id",
    "scene_id",
    "sequence_index",
    "narrative_job",
    "felt_intent",
    "target_duration_sec",
    "generation_mode",
    "shot_structure",
    "already_happened",
    "this_clip_only",
    "reserved_for_later",
    "planned_start_state",
    "planned_end_state",
    "continuity_locks",
    "allowed_changes",
    "status"
  ],
  "properties": {
    "project_id": {"type": "string", "minLength": 1, "pattern": "\\S"},
    "clip_id": {"type": "string", "minLength": 1, "maxLength": 256, "pattern": "\\S"},
    "parent_clip_id": {"type": ["string", "null"], "minLength": 1, "maxLength": 256, "pattern": "\\S"},
    "scene_id": {"type": "string", "minLength": 1, "pattern": "\\S"},
    "sequence_index": {"type": "integer", "minimum": 1},
    "narrative_job": {"type": "string"},
    "felt_intent": {"type": "string", "minLength": 1, "pattern": "^(?=.*[^\\s\\u00ad\\u034f\\u0600-\\u0605\\u061c\\u06dd\\u070f\\u08e2\\u115f-\\u1160\\u17b4-\\u17b5\\u180b-\\u180f\\u200b-\\u200f\\u202a-\\u202e\\u2060-\\u2064\\u2066-\\u206f\\u2800\\u3164\\ufe00-\\ufe0f\\ufeff\\uffa0\\ufff0-\\ufffb\ud804\udcbd\ud804\udccd\ud80d\udc30-\ud80d\udc38\ud82f\udca0-\ud82f\udca3\ud834\udd73-\ud834\udd7a\udb40\udc00-\udb43\udfff])[^\\r\\n\\u000b\\u000c\\u001c\\u001d\\u001e\\u0085\\u2028\\u2029]+$"},
    "directors_read_lane": {"enum": ["narrative", "non_narrative"]},
    "authoring_state": {"$ref": "#/$defs/authoring_state"},
    "authoring_state_provenance": {"$ref": "#/$defs/authoring_state_provenance"},
    "target_duration_sec": {"type": ["number", "null"]},
    "generation_mode": {"type": "string"},
    "shot_structure": {"enum": ["compact_single_take", "phased_single_take", "dense_multishot", "first_last_frame_transition", "video_edit_contract"]},
    "already_happened": {"type": "array", "items": {"type": "string"}},
    "this_clip_only": {"type": "array", "items": {"type": "string"}},
    "reserved_for_later": {"type": "array", "items": {"type": "string"}},
    "planned_start_state": {"type": "object"},
    "planned_end_state": {"type": "object"},
    "observed_start_state": {"type": ["object", "null"]},
    "observed_end_state": {"type": ["object", "null"]},
    "continuity_locks": {"type": "array"},
    "allowed_changes": {"type": "array"},
    "status": {"enum": ["planned", "ready", "generated", "reviewed", "accepted", "accepted_with_deviation", "repair", "rejected"]}
  },
  "allOf": [
    {
      "if": {
        "properties": {"sequence_index": {"const": 1}},
        "required": ["sequence_index"]
      },
      "then": {
        "properties": {"parent_clip_id": {"type": "null"}}
      },
      "else": {
        "required": ["parent_clip_id"],
        "properties": {
          "parent_clip_id": {"type": "string", "minLength": 1, "pattern": "\\S"}
        }
      }
    },
    {
      "if": {
        "properties": {
          "status": {"enum": ["accepted", "accepted_with_deviation"]}
        },
        "required": ["status"]
      },
      "then": {
        "required": ["observed_end_state"],
        "properties": {
          "observed_end_state": {"type": "object", "minProperties": 1}
        }
      }
    },
    {
      "if": {
        "properties": {"status": {"const": "rejected"}},
        "required": ["status"]
      },
      "then": {
        "required": ["observed_end_state"],
        "properties": {"observed_end_state": {"type": "null"}}
      }
    },
    {
      "if": {
        "anyOf": [
          {"required": ["authoring_state"]},
          {"required": ["authoring_state_provenance"]}
        ]
      },
      "then": {
        "required": [
          "directors_read_lane",
          "authoring_state",
          "authoring_state_provenance"
        ]
      }
    },
    {
      "if": {
        "required": ["directors_read_lane"],
        "properties": {"directors_read_lane": {"const": "narrative"}}
      },
      "then": {
        "required": ["authoring_state", "authoring_state_provenance"],
        "properties": {"authoring_state": {"$ref": "#/$defs/narrative_authoring_state"}}
      }
    },
    {
      "if": {
        "required": ["directors_read_lane"],
        "properties": {"directors_read_lane": {"const": "non_narrative"}}
      },
      "then": {
        "required": ["authoring_state", "authoring_state_provenance"],
        "properties": {"authoring_state": {"$ref": "#/$defs/non_narrative_authoring_state"}}
      }
    }
  ],
  "$defs": {
    "authoring_state_provenance": {
      "type": "object",
      "required": [
        "project_id",
        "clip_id",
        "canon_revision",
        "state_revision",
        "authoring_state_sha256"
      ],
      "properties": {
        "project_id": {"type": "string", "minLength": 1},
        "clip_id": {"type": "string", "minLength": 1},
        "canon_revision": {"type": "integer", "minimum": 1},
        "state_revision": {"type": "integer", "minimum": 1},
        "authoring_state_sha256": {"type": "string", "pattern": "^[0-9a-f]{64}$"}
      },
      "additionalProperties": false
    },
    "authoring_state": {
      "oneOf": [
        {"$ref": "#/$defs/narrative_authoring_state"},
        {"$ref": "#/$defs/non_narrative_authoring_state"}
      ]
    },
    "narrative_authoring_state": {
      "type": "object",
      "description": "Complete canonical narrative Director's Read plus explicit value endpoints and auditable prompt carriers.",
      "required": [
        "dramatic_function",
        "turn",
        "pov",
        "power_shift",
        "hidden_want_objective",
        "obstacle_tactic",
        "subtext_contradiction",
        "visible_suppressed_behavior",
        "non_transferable_detail",
        "non_transferable_detail_provenance",
        "non_transferable_detail_source",
        "stock_solution_refused",
        "value_before",
        "value_after",
        "prompt_carriers"
      ],
      "properties": {
        "dramatic_function": {"type": "string", "minLength": 1, "pattern": "^[^\\r\\n\\u000b\\u000c\\u001c\\u001d\\u001e\\u0085\\u2028\\u2029]+$"},
        "turn": {"type": "string", "minLength": 1, "pattern": "^[^\\r\\n\\u000b\\u000c\\u001c\\u001d\\u001e\\u0085\\u2028\\u2029]+$"},
        "pov": {"type": "string", "minLength": 1, "pattern": "^[^\\r\\n\\u000b\\u000c\\u001c\\u001d\\u001e\\u0085\\u2028\\u2029]+$"},
        "power_shift": {"type": "string", "minLength": 1, "pattern": "^[^\\r\\n\\u000b\\u000c\\u001c\\u001d\\u001e\\u0085\\u2028\\u2029]+$"},
        "hidden_want_objective": {"type": "string", "minLength": 1, "pattern": "^[^\\r\\n\\u000b\\u000c\\u001c\\u001d\\u001e\\u0085\\u2028\\u2029]+$"},
        "obstacle_tactic": {"type": "string", "minLength": 1, "pattern": "^[^\\r\\n\\u000b\\u000c\\u001c\\u001d\\u001e\\u0085\\u2028\\u2029]+$"},
        "subtext_contradiction": {"type": "string", "minLength": 1, "pattern": "^[^\\r\\n\\u000b\\u000c\\u001c\\u001d\\u001e\\u0085\\u2028\\u2029]+$"},
        "visible_suppressed_behavior": {"type": "string", "minLength": 1, "pattern": "^[^\\r\\n\\u000b\\u000c\\u001c\\u001d\\u001e\\u0085\\u2028\\u2029]+$"},
        "non_transferable_detail": {"type": "string", "minLength": 1, "pattern": "^[^\\r\\n\\u000b\\u000c\\u001c\\u001d\\u001e\\u0085\\u2028\\u2029]+$"},
        "non_transferable_detail_provenance": {"enum": ["source_bound", "authored_choice"]},
        "non_transferable_detail_source": {"type": ["string", "null"]},
        "stock_solution_refused": {"type": "string", "minLength": 1, "pattern": "^[^\\r\\n\\u000b\\u000c\\u001c\\u001d\\u001e\\u0085\\u2028\\u2029]+$"},
        "value_before": {"type": "string", "minLength": 1, "pattern": "^[^\\r\\n\\u000b\\u000c\\u001c\\u001d\\u001e\\u0085\\u2028\\u2029]+$"},
        "value_after": {"type": "string", "minLength": 1, "pattern": "^[^\\r\\n\\u000b\\u000c\\u001c\\u001d\\u001e\\u0085\\u2028\\u2029]+$"},
        "prompt_carriers": {
          "type": "array",
          "minItems": 1,
          "uniqueItems": true,
          "items": {"type": "string", "minLength": 1, "pattern": "^[^\\r\\n\\u000b\\u000c\\u001c\\u001d\\u001e\\u0085\\u2028\\u2029]+$"}
        }
      },
      "allOf": [
        {
          "if": {"properties": {"non_transferable_detail_provenance": {"const": "source_bound"}}},
          "then": {
            "properties": {
              "non_transferable_detail_source": {
                "type": "string",
                "minLength": 1,
                "pattern": "^(?:@[A-Za-z][A-Za-z0-9]*(?:[ \\t]+[0-9]+)?|\\[[^\\]\\r\\n\\u000b\\u000c\\u001c\\u001d\\u001e\\u0085\\u2028\\u2029]+\\]|https?://\\S+|(?:file|ref|evidence):\\S+)$"
              }
            }
          }
        },
        {
          "if": {"properties": {"non_transferable_detail_provenance": {"const": "authored_choice"}}},
          "then": {"properties": {"non_transferable_detail_source": {"const": null}}}
        }
      ],
      "additionalProperties": false
    },
    "non_narrative_authoring_state": {
      "type": "object",
      "description": "Complete canonical two-line non-narrative Director's Read.",
      "required": ["utility_intent", "non_narrative_refusal"],
      "properties": {
        "utility_intent": {"type": "string", "minLength": 1, "pattern": "^[^\\r\\n\\u000b\\u000c\\u001c\\u001d\\u001e\\u0085\\u2028\\u2029]+$"},
        "non_narrative_refusal": {"type": "string", "minLength": 1, "pattern": "^[^\\r\\n\\u000b\\u000c\\u001c\\u001d\\u001e\\u0085\\u2028\\u2029]+$"}
      },
      "additionalProperties": false
    }
  }
}
